text,movement,style,year,corpus,var
" Их познакомил тот самый художник Василий Алексеевич Ватагин, к которому ещё мальчиком привязался Олег Цингер и который приехал специально из Москвы в Берлин, чтобы поработать в Берлинском зоологическом саду. ",1,0,1987,0,из
" В письмах друзей из Москвы обо всем этом говорилось глухо, намёками. ",0,0,1987,0,из
" Приезжали из Москвы, из Обнинска, Игорь Борисович Паншин прилетел из Норильска. ",1,0,1987,0,из
" Пока из Москвы приезжали Вавилов, Вернадский, тот же Кольцов и другие, пока существовало свободное общение, переписка, командировки, он не ощущал никакой тоски. ",1,0,1987,0,из
" Сам я тоже из Москвы, с Таганской площади. ",0,0,1987,0,из
" Зубр вмешивался, указывал, с такой энергией, что поначалу его приняли за присланного откуда-то из Москвы уполномоченного. ",1,0,1987,0,из
"  Прилетел из Москвы Лев Андреевич Арцимович, известный уже в то время физик. ",1,0,1987,0,из
" На симпозиумы начали приезжать из Москвы, Ленинграда, Новосибирска, Киева. ",1,0,1987,0,из
 Из Москвы кто-то привозил не так давно. ,1,0,1987,0,из
 Из Москвы их два― утром и вечером. ,1,0,1987,0,из
" ― А я-то чувствую: из лесу русским духом пахнет, а ко мне гость из Москвы. ",0,1,1985,0,из
"  Натэлла приехала из Москвы, движимая романтическими, вернее ― авантюрными целями. ",1,0,1983,0,из
"  ― Поздоровался бы, Воронов, сказал Степан, вот кочегара Офштейна ещё сегодня не видел.  И вот товарищ из Москвы.   ― Ах, из Москвы… ",0,1,1989,0,из
"  ― Поздоровался бы, Воронов, сказал Степан, вот кочегара Офштейна ещё сегодня не видел.  И вот товарищ из Москвы.   ― Ах, из Москвы… ",0,1,1989,0,из
" И вот товарищ из Москвы.   ― Ах, из Москвы…  Ну что там? ",0,1,1989,0,из
" И вот товарищ из Москвы.   ― Ах, из Москвы…  Ну что там? ",0,1,1989,0,из
" А то опять увижу… …  Возвращаюсь из Москвы, везу анекдотец.  ""Шаху отрезали ногу…"" ",1,0,1981,0,из
" Придёт из Москвы бумажка ""слушали ― постановили"", и сиди ещё пять лет. ",1,0,1978,0,из
 У меня вот дочь приезжает из Москвы на каникулы. ,1,0,1978,0,из
" Вчера он из Москвы вернулся поздно, прихватил с собой ещё несколько человек, и они часов до двух сидели за столом, и он за разговором, потихоньку-помаленечку, а рюмка за рюмкой выпил, наверно, с полбутылки красного вина, Вино это было из самых его любимых ― красное, терпкое, очень кислое, такое делали только в одной местности в Грузии. ",1,0,1978,0,из
"  «Будьте щепетильны, будьте крайне щепетильны в отношении ОСО, ― заклинал на общем собрании наркомата Роман Львович Штерн, высокий гость из Москвы и двоюродный брат этого самого Неймана.― Не теряйте чувства стиля! ",0,0,1978,0,из
 У Неймана до таких штучек ещё нос не дорос.  Небось какой-нибудь зам из Москвы прихватил.  Но хороша! ,0,0,1978,0,из
"  ― Да нет, ― объяснила она словоохотливо. ― Я недавно только приехала из Москвы. ",1,1,1978,0,из
 Тут на них из Москвы хорошенько и цыкнули. ,1,0,1978,0,из
" Так вот, может, чтоб не вызывать ненужные ассоциации, и решили его из Москвы ― сюда?! ",1,0,1978,0,из
" Сейчас вот каких-то бумаг из Москвы ожидает, чтоб к родным ехать. ",1,0,1978,0,из
  ― А на этих электричках всегда только вот такие из Москвы возвращаются. ,1,1,1977,0,из
" Так или иначе, она влюбила в себя рязанского поэта, сама в него влюбилась без памяти, и они улетели за границу из Москвы на дюралевом ""юнкерсе"" немецкой фирмы ""Люфтганза"". ",1,0,1976,0,из
" Приехав из Москвы и увидев эту картину, я понял, что оставаться птицелову в Одессе невозможно. ",1,0,1976,0,из
 Ключик поехал в Петроград из Москвы по каким-то газетным делам. ,1,0,1976,0,из
" Летом наезжали дачники из Чернигова, Киева, даже из Москвы и Петербурга. ",1,0,1976,0,из
" Такого чистого, сухого, смолистого воздуха, как в этом лесу, я думаю, вы нигде не найдёте, недаром подышать этим воздухом приезжали дачники даже из Москвы и Петербурга. ",1,0,1976,0,из
" Между прочим, и в двадцатые годы в наш город приезжали дачники из Москвы и Ленинграда и ходили с гамаками в лес. ",1,0,1976,0,из
" Помню, приезжал некий театральный критик из Москвы, Соня принимала его по первому разряду, хотя за глаза, смеясь, называла дуболомом, надеялась, что он похвалит её в газете, и действительно он упомянул её в рецензии одной фразой: ""Спорно, но интересно толкование этого образа актрисой Вишневской"". ",0,0,1976,0,из
" И чтобы дело не стояло, тем более я уезжал в Ленинград, я пошёл на фабрику, взял у Броневского нормативные справочники и своей рукой внёс изменения, полученные из Москвы, а ему велел пересчитать расценки. ",1,0,1976,0,из
" Давайте созовём совещание, пригласим представителя из Москвы и разберёмся. ",1,0,1976,0,из
"  Приезжает представитель из Москвы, созываем совещание, приглашаем мастеров с фабрики, из районов, слово дают Броневскому: мол, какие у вас претензии… ",1,0,1976,0,из
" Представитель из Москвы подтвердил, что ничего я сам не придумал, инструкцию дала Москва. ",0,0,1976,0,из
 За несколько дней до вылета из Москвы пришла мне в голову счастливая идея ― пустить среди своих друзей анкету. ,1,0,1976,0,из
" Родителей Медведя перевели куда-то по работе, они уехали из Москвы, и Медведь уехал с ними, а Манюня очень плохо учился, его выгнали из школы, он попал в ""лесную школу"", оттуда сбежал, связался с блатными и во время войны сидел по уголовным делам в лагере. ",1,0,1976,0,из
" Ведь люди в войну последнее продавали, все нажитки, чтоб не пропасть ― баба Нила продала серебряные ложки, подстаканник, коврик, шали, всё хоть немного ценное, что из Москвы везли, даже свой крестик нательный, потому что Глебов умирал, литр молока на рынке стоил примерно так же, как серебряная ложечка, ― а тут новое накоплено и, смотри-ка, Айвазовский. ",1,0,1976,0,из
" И вот дед спросит: ""Что вам, мамаша, из Москвы привезти?""― ""А постного сахарку, Николай Ефимович, если по силе-возможности!"" Ну, конечно, на великий пост посылали с оказией. ",1,1,1976,0,из
" Помню, на крыше встретил Антона с тремя парнями, а потом бегали на квартиру к Соне Ганчук, и там был Вадька Батон, который на другой день уезжал из Москвы. ",1,0,1976,0,из
"  ― Из Москвы, а что? ― ответила девушка и на всякий случай посмотрела на берег, прикидывая, не опасна ли на такой глубине разговаривать с чужими мужчинами. ",1,1,1973,0,из
"  ― Ты чего это тут бдительность развёл? ― спросил он.  ― Это товарищ Степанов, профессор, из Москвы…  Тебе уж теперь на каждом шагу будут воры казаться. ",0,1,1971,0,из
  Из Москвы Иван двинул домой второе письмо. ,1,0,1971,0,из
"  ""Уважаемые родные, друзья!   Пишу вам из Москвы.  Нас здесь захватил водоворот событий. ",1,0,1971,0,из
 Крепко целую тебя.  Из Москвы напишу письмо.  Твой Димка. ,1,0,1971,0,из
"  Выехав из Москвы, они свернули с асфальта и долго ехали по просёлочной дороге, потом петляли по лесу и наконец остановились перед табличкой, на которой было написано СТОП! ",1,0,1971,0,из
" Дмитриев очень жалел, что так получилось, что муж сделался несчастным человеком, бросил работу, уехал из Москвы, и Таня тоже стала несчастным человеком, но ничего поделать было нельзя. ",1,0,1969,0,из
" Соседи меня притесняют как хотят, мой сундук выбросили, мою полку со стены сорвали ― они знают, что я слова не смею… что меня можно выселить из Москвы! ",1,0,1979,0,из
" Год срока ему кончался, но судимость оставалась, и, чтоб не выслали из Москвы, он очень просил начальство оставить его на этой работе и вольным, б на полутора тысячах. ",1,0,1979,0,из
"  Писать всё, как есть ― значило быть выгнанной к концу недели из университета, из общежития, из Москвы. ",1,0,1979,0,из
"  ― Товарищ дежурный, прибыла специальная группа из Москвы для выполнения работ в войсковой части. ",1,1,1967,0,из
" А вы откудова?   ― Из Москвы, ― ответила Лида.   ― В Москве, говорят, снабжение хорошее. ",0,1,1967,0,из
" Откуда?  Ого, из Москвы!  А я, между прочим, из Шотландии. ",0,1,1966,0,из
 Он ещё за год или за два уехал из Москвы. ,1,0,1964,0,из
"  Выезжал я из Москвы в ростепель, в хмурую и тёплую погодку. ",1,0,1964,0,из
" Его недавно по распределению прислали к нам из Москвы, но он уже сумел задать тон всей редакции: ""Старик"""" Старуха"""" А не пойти ли нам, старуха, в"" Белую лошадь ""…"" ",1,0,1964,0,из
"  Снова мы блуждали по эфиру, слушали голоса городов и станций, неслись из Москвы в Копенгаген, из Копенгагена в Капштадт и Гавану. ",1,0,1964,0,из
"  ― Есть ещё один способ, ― напористо продолжал парень. ― Известно, что в этот город часто приезжают девушки из Москвы и Ленинграда для того, чтобы рассеяться после сердечных неудач. ",1,0,1963,0,из
" Мне просто надо было уехать из Москвы, а во-вторых, почему бы мне не быть здесь? ",1,0,1963,0,из
" Не просто фифа из Москвы, а с характером и с печалью. ",0,0,1963,0,из
"  Он лежал на койке врача, слушал последние известия из Москвы, когда раздался сильный стук в дверь. ",1,0,1963,0,из
" Одни говорили, что приехавший из Москвы в область следователь по особо важным делам не побоится обнародовать причастность к делу всего городского начальства. ",1,0,1969,0,из
"  ― Что ты, первый раз из Москвы уехала? ",1,1,1961,0,из
" Ребята представились хозяину и сказали, что они студенты-ихтиологи из Москвы и приехали сюда для изучения нравов рыб Финского залива. ",0,0,1961,0,из
 Привозит нам сигареты с фильтром.   АЛИК СТАЛ ПОЛУЧАТЬ ПИСЬМА из Москвы.  Однажды я увидел обратный адрес: ,1,0,1961,0,из
" Не хочется ни о чём думать, а думаю я о том, что Витька, наверное, уже вылетел из Москвы в неизвестном направлении.  (",1,0,1961,0,из
" Его догадка была верной ― письмо было из Москвы, от жены. ",0,0,1958,0,из
 Перед войной она приехала погостить из Москвы и застряла. ,1,0,1960,0,из
" Это была временная, эвакуированная из Москвы столица, с дипломатическим корпусом, с балетом Большого театра, со знаменитыми писателями, с московскими конферансье, с иностранными журналистами. ",1,0,1960,0,из
"  Соседка, Муся Борисовна, рассказала, что Давид приехал погостить к бабушке из Москвы и война отрезала его от матери. ",1,0,1960,0,из
"  Он постучал пальцем по радиопередатчику, покосился на небо, где ныли немецкие бомбардировщики.   ― Вы из Москвы, девушка? ― спросил он.   ― Да, ― ответила она. ",0,0,1960,0,из
" Когда Степан Фёдорович через штаб стоявшей поблизости 64-й армии связывался с Москвой по телефону ВЧ и заместитель наркома говорил: ""Товарищ Спиридонов, передайте привет из Москвы героическому коллективу, который вы возглавляете"", Степану Федоровичу становилось неловко, ― где уж там героизм. ",1,0,1960,0,из
"  ― Да ещё сообщение из Москвы ― о ликвидации Коминтерна, что ли. ",1,1,1960,0,из
"  ― Вот что, товарищ Мостовской, ― медленно сказал Осипов. ― От вас секретов у нас нет.  Здесь находится заброшенный из Москвы товарищ.  Могу назвать его ― Котиков. ",1,1,1960,0,из
"  Он стал рассказывать Новикову слышанные от старого товарища, секретаря обкома, новости, ― тот накануне вернулся из Москвы, где был принят одним из тех людей, что в дни праздников поднимаются на мавзолей, но не стоят на мавзолее возле микрофона, рядом со Сталиным. ",1,0,1960,0,из
" Мне говорили, что неожиданно запросили из Москвы о его результатах. ",1,0,1960,0,из
"  ―Вот-вот, совершенно верно, ― сказал Бова, ― в сорок первом году двух полковников к нам в армию из Москвы прислали проверить этот самый приказ ""Ни шагу назад"". ",1,0,1960,0,из
" Я увидел деревни, умирающие голодной смертью, я увидел крестьянских детей, умирающих в сибирском снегу, я видел эшелоны, везущие в Сибирь сотни и тысячи мужчин и женщин из Москвы, Ленинграда, из всех городов России, объявленных врагами великой и светлой идеи общественного добра. ",0,0,1960,0,из
"  Люди забывали, что некоторые, не попавшие в эшелоны в роковые октябрьские дни 1941 года, бросали чемоданы и узлы, пешком уходили на Загорск, лишь бы вырваться из Москвы. ",1,0,1960,0,из
"  Главная суть двух таких противоположных состояний ― страстной тяги из Москвы и страстной тяги в Москву ― состояла в том, что год прошедшей войны преобразовал сознание людей, и мистический страх перед немцами сменился уверенностью в превосходстве русской советской силы. ",1,0,1960,0,из
  ― Давно ли вы имели письмо из Москвы? ― спросил Каримов. ,1,1,1960,0,из
"  ― Вот как, ― сказал Каримов и улыбнулся. ― А интересно, как долго идут письма из Москвы? ",1,1,1960,0,из
"  ― Только, ради Бога, я вам ничего не рассказывала, ― подведя Женю к двери, осмелев, соседка зашептала: ― Такой был хороший человек, добровольцем на войну пошёл.   Новикову она из Москвы не писала.   Какая смута в душе! ",1,1,1960,0,из
"  Слегка выпивший полковник Филимонов, накануне прибывший из Москвы в штаб Сталинградского фронта, стоял вместе с прикомандированным к нему переводчиком на пункте сдачи частей дивизии генерала Веллера. ",1,0,1960,0,из
"  ― Как там, телеграммы насчёт кабеля нет из Москвы? ",1,1,1960,0,из
" Писала мать, учительница из небольшого волжского городка, и сестра из Москвы. ",0,0,1946,0,из
"  ― Я это и говорю, ― прогнусил рыжий и, повернувшись к Воланду, добавил почтительно: ― Разрешите, мессир, его выкинуть ко всем чертям из Москвы? ",1,1,1934,0,из
" Через несколько секунд он, осёдланный, летел куда-то к чёрту из Москвы, рыдая от горя. ",1,0,1934,0,из
" Но если допустить первое, то несомненно, что, проваливаясь, он прихватил с собой всю головку администрации Варьете, а если второе, то не выходит ли, что сама администрация злосчастного театра, учинив предварительно какую-то пакость (вспомните только разбитое окно в кабинете и поведение Тузабубен!), бесследно скрылась из Москвы. ",1,0,1934,0,из
" Из Москвы телеграммой было приказано Римского под охраной доставить в Москву, вследствие чего Римский в пятницу вечером и выехал под такой охраной с вечерним поездом. ",1,0,1934,0,из
" Теперь стало ясно, что Воланд проник в Варьете под видом артиста, загипнотизировав Степу Лиходеева, а затем ухитрился выбросить этого же Степу вон из Москвы за бог знает какое количество километров. ",1,0,1934,0,из
" По его словам выходило, что Наташа вылетела из окна, оседлала его и повлекла вон из Москвы… ",1,0,1934,0,из
 Это он и его шайка заставили исчезнуть из Москвы Маргариту Николаевну и её домработницу Наташу. ,1,0,1934,0,из
"  Опомнившись, примерно через сутки после визита к Воланду, в поезде, где-то под Вяткой, Алоизий убедился в том, что, уехав в помрачении ума зачем-то из Москвы, он забыл надеть брюки, но зато непонятно для чего украл совсем ненужную ему домовую книгу застройщика. ",1,0,1934,0,из
"  Из Москвы Кипренский переехал в Тверь, где в то время жила дочь Павла Первого, принцесса Екатерина Павловна. ",1,0,1936,0,из
" Он нетерпеливо скакал из Москвы в Тверь на перекладных, чтобы сообщить последние вести о баталиях и выслушать чтение высокопарных стихов и шум страстных споров. ",1,0,1936,0,из
" Но начиная с первых лет войны Кисловодск был уже наводнён разорившимися дамами, прогоревшими артистами и молодыми людьми из Москвы и Петербурга; эти молодые люди ездили верхом на наёмных лошадях и отчаянно трясли локтями, точно кто-то подталкивал их под руку. ",0,0,1930,0,из
" Из Москвы он сейчас же возвращался обратно ― дела ему там не было, ― и снова дорогу ему переступали всякие знакомые, которых он угощал. ",1,0,1928,0,из
