text,movement,style,year,corpus,var
"  O Дюма, который провёл в Российской империи девять месяцев и всё это время находился под наблюдением, докладывает из Москвы генерал-лейтенант Перфильев: “Он имеет страсть приготовлять сам на кухне кушанья и, говорят, мастер этого дела”. ",1,0,2002,0,из
" То есть садился на поезд, ехал в Москву или из Москвы… ",1,0,2004,0,из
"  Уральский ИТ-форум дал понять гостям из Москвы: в регионе создана своя ""среда"", конкурировать в которой будет непросто ",0,0,2004,0,из
" На этих заседаниях тон задавали гости из Москвы, где эти проблемы встали раньше. ",0,0,2004,0,из
  В Республиканской детской больнице N 1 появился доставленный из Москвы спиральный компьютерный томограф фирмы стоимостью 38 млн. руб. Один компьютерный томограф уже функционирует во 2-ой детской больнице. ,1,0,2004,0,из
"  Типично французский вопрос: ""Бенедикт, к тебе приезжал русский друг из Москвы, а на каком языке ты с ним общалась?"" ",1,0,2004,0,из
 Чтобы рядом кто-то был.  Кто-нибудь из Москвы.  Сами мы не справимся… ,0,0,2004,0,из
" Эта встреча наверняка заинтересовала бы тарковсковедов из Москвы, Санкт-Петербурга, других городов? ",0,0,2004,0,из
" К нам приезжали Елена Салейкова из Москвы, Сергей Грязнов из Тюмени, Анатолий Тучков из Краснодара. ",0,0,2004,0,из
" А если нет, то через неделю любую из Москвы привезут, только аванс заплати, что точно купишь. ",1,0,2004,0,из
" В Новом Уренгое устроили праздник для самых младших зрителей: программа составлена из сказок, каждый день на двух сценах Культурно-спортивного центра ""Газодобытчик"" (большой и малой) шли спектакли детских и кукольных театров из Москвы и Нижнего Новгорода, Кемерово и Краснодара, Старого Оскола и Тюмени. ",0,0,2004,0,из
" Они бессмысленно жгут топливо, расходуют снабжение, и при этом десятки тысяч членов экипажей не зарабатывают ни копейки ― ждут решения из Москвы. ",1,0,2003,0,из
" При этом неважно, будет ли этот преемник родом из Москвы или из Питера. ",0,0,2003,0,из
 Так и будут рассчитывать размер помощи из Москвы. ,1,0,2003,0,из
" Туда в девственные леса ""непуганых зверей"", было решено перенести Главный штаб Войск ПВО из Москвы. ",1,0,2003,0,из
" Ходили слухи, что новые владельцы собираются перевезти команду из Москвы в Красноярск, чтобы она и географически стала бы окончательно"" никелированной "". ",1,0,2003,0,из
" Клуб из Москвы традиционно является достаточно привлекательным"" брэндом ""для отечественных, а иногда и зарубежных спонсоров. ",0,0,2003,0,из
"  Из Москвы поезжайте в любом направлении, ― заметил Г. Зюганов, ― ещё выборная кампания не началась, а на всех рекламных щитах уже смотрит на вас Жириновский: он якобы за русских и за бедных. ",1,0,2003,0,из
"  Сам Коданев предвидел арест и рассказал об этом ещё за несколько часов до задержания в интервью газете ""Время новостей"": "" Мне позвонили друзья из Москвы и сказали, что ФСБ дала приказ на моё задержание"". ",0,0,2003,0,из
" В том вытрезвителе как раз и грабили таких вот― иногородних с билетами, которые должны были вот-вот уехать из Москвы. ",1,0,2003,0,из
  Справки по телефону: 73-06-12 (код из Москвы ― 8-27. из других городов ― 8-0967). ,1,0,2003,0,из
"  Проезд из Москвы до Пущино: авт. 359 от ст. м. ""Южная"", отправление; 8-20; 9-05; 10-05; 11-05; 13-55; 15-05; 16-05; 17-05; 18-30; 19-40; 20-10 (пятн.); 20-40. ",1,0,2003,0,из
" Двадцать бегунов ― шипящих мадагаскарских тараканов ― были привезены из Москвы, сообщила артдиректор клуба Яна Кряжевских. ",1,0,2003,0,из
"  Позвонил из Москвы и сообщил, что вернётся через три дня, во вторник. ",1,0,2002,0,из
"  Его осмотрели детские кардиологи, профессор из Манилы и Карнаухов из Москвы. ",0,0,2002,0,из
 На церемонию открытия специально из Москвы прилетела делегация российского представительства GM. ,1,0,2002,0,из
" Армейцы, так и не услышавшие от диктора по стадиону желанных новостей из Москвы, после финального свистка радостно вскинули руки, пообнимались немного и отправились в раздевалку. ",1,0,2002,0,из
" Когда мы в шесть утра вышли из прилетевшего из Москвы ""Боинга"" и окунулись в тёмную, подсвеченную фонарями мерзлоту Новосибирского аэродрома, дыхание от этого сухого мороза перехватило ничуть не меньше, чем от мокрого петербургского. ",1,0,2002,0,из
" К 1941 году здание было закончено, и во время войны в нём хранились коллекции эвакуированных из Москвы и Ленинграда музеев: Третьяковской галереи, Павловского дворца и других. ",1,0,2002,0,из
"  ― Вот, журналистов задержал, из Москвы, ― вытягиваясь в струнку, отрапортовал командир роты. ",0,1,2002,0,из
" Поэтому не стоит удивляться, что, руководя действиями своей команды из Москвы по телефону, главный тренер ""Спартака"" сумел добиться ничьей в противостоянии сразу с двумя тренерами ""Уралана"" ― Юрием Шишловым и Ревазом Дзодзуашвили. ",1,0,2002,0,из
" Когда решался вопрос об отъезде из Москвы, Гарлицкий буквально присягал учителю. ",1,0,2002,0,из
"  Помню, спустя несколько месяцев после того, как Собчак проиграл выборы, мы ехали на 70-летие Галины Павловны в тот дом, который был куплен Ростроповичем и Вишневской в Питере в эпоху Собчака.  Из Москвы прилетело высокое начальство.  Естественно, на праздник был приглашён и новый губернатор. ",1,0,2002,0,из
" Увидев написанный им портрет одной своей приятельницы, я стала специально приезжать из Москвы позировать. ",1,0,2002,0,из
 И вот в один из свободных дней в Бостоне в нашу маленькую гостиницу пришёл факс из Москвы. ,1,0,2002,0,из
" Соревновались 150 конкурсантов из Москвы и регионов России, но в финал вышли 27 человек, среди которых лауреатами и дипломантами стала почти половина. ",0,0,2002,0,из
" Зрители― детишки из Москвы и регионов России, которых специально пригласили в цирк по случаю празднования Дня защиты детей, остались довольны. ",0,0,2002,0,из
" Поэтому совершенствовать русский в живой беседе у нас было немного возможностей, одна из них ― самая приятная ― в коридоре поезда ""Красная стрела"" из Москвы в Ленинград, туда КГБ просто иногда не успевал. ",1,0,2002,0,из
"  Хитцфельд выглядел более осторожным и после обязательных комплиментов в адрес соперника откровенно признался, что намерен действовать от обороны ― на контратаках, не забывая про возможность увезти из Москвы три очка. ",1,0,2001,0,из
" Гостинцем из Москвы, ― сказал он и тут же умолк под осуждающим взглядом командира. ",0,0,2001,0,из
" Костя испытывал неловкость перед этими присланными, как он понял, из Москвы партизанами. ",1,0,2001,0,из
" Переехала из Москвы в 1959 году с мужем, научным сотрудником ИТПМ. ",1,0,2001,0,из
  После переезда Пушкиных из Москвы в Петербург Наталья Николаевна была с восхищением принята при дворе. ,1,0,2001,0,из
" Хотелось всем дать понять, что мы не за этим уехали из Москвы, а когда последовал жест Горбачева ― что не побежим обратно, стоит нас только пальчиком поманить. ",1,0,2001,0,из
" А от моего внимания этот факт ускользнул ― пока есть ещё запасы, взятые из Москвы. ",1,0,2001,0,из
" Основной поток транспорта из Москвы направляется через Санкт-Петербург и Выборг на Брусничную или Торфяновку только потому, что эта трасса в нормальном состоянии. ",1,0,2000,0,из
"  Многие приезжали из Москвы и здесь же на безлесом берегу жгли костры, сидели всю ночь у донок с резинками, прислушиваясь, не зазвенит ли во тьме колокольчик, который позднее спас влюбленного Колюню от припадка ревности и тоски, а самые основательные и преданные переправлялись на надувных лодках на острова или, заякорившись, ловили с глубины. ",1,0,2000,0,из
"  А кроме того, как бы ни был суров и непримирим ко всякой иностранщине повзрослевший и абстрактно русофильствовавший на новом витке сентиментального патриотизма Колюня, в его благодарной и непослушной памяти сохранился гул пёстрой, разноголосой, разноязыкой толпы, бродившей по набережным Чёрного моря, куда перебрался из Москвы детский праздник, фейерверки тёплых ночей, песни и пляски, карнавал, гомон, перепачканные сажей девичьи лица, ребячий смех, бодрый старичок Бенжамин Спок  , по которому воспитывала детей и горя не знала огромная легкомысленная страна, радостное возбуждение, костры, и всё это странное, удивительное прикосновение к многообразию и величию мира, здесь собравшегося, и неясное понимание, что славянский мальчик из дачного местечка под Москвой есть только крохотная частица людской вселенной. ",1,0,2000,0,из
 Да и не наездитесь вы из Москвы на эту дачу! ,1,0,2000,0,из
" По замыслу, заряд должен был бы летать на околоземной орбите как обычный спутник, а в нужный момент по команде из Москвы обрушиться на Америку. ",0,0,2000,0,из
" Когда меня забрали родители от бабушки, из Москвы перевезли в колонию, под Сочи, весной двадцатого года. ",1,0,2000,0,из
" Из соображений предосторожности решено было, что он уедет на время из Москвы. ",1,0,2000,0,из
"  В лагере обошлось без декоративных свидетелей ― только начальник по режиму и приехавший из Москвы адвокат, который и добился разрешения на тюремный брак. ",1,0,2000,0,из
"  ― Да и как они умудрились осла наверх затащить? ***   ― Скажите, вы, случайно, не из Москвы?   ― Нет. ",0,1,1985,0,из
"  - А я деньги получил из Москвы ― за книгу ""Зелёные цветы"". ",1,1,2000,0,из
"  На похороны поэта из Москвы приехал тихий и больной человек, тоже поэт― Борис Примеров. ",1,0,2000,0,из
" После этого Эмиль отбыл на долговременные гастроли в Японию, всё практически перепоручив мне, ― я к тому времени от цирка отошёл, открыл собственную фирму и мог не уезжать из Москвы. ",1,0,1997,0,из
" Из работавших со мной девушек не могу не назвать Любу Макарову из балета, рижанку Таню Борину, Жанну Власову, Женю Никоненко, которая стала ныне хозяйкой модного салона женской одежды в Москве, Свету Травникову и Нину Тоцкую из Ленинграда, совсем молодых Катю Дорогину из Перми и Ларису Князеву из Москвы. ",0,0,1997,0,из
 И вдруг звонит мне ночью из Москвы мама с новостью ― арестован Колеватов. ,1,0,1997,0,из
"  Не всё ещё было потеряно, ещё можно было спасти себя для Таисии, для настоящей жизни: сбежать из Москвы глухой тёмной ночью, добраться до Гороховея, чтоб и оттуда сбежать, вместе с Таисией. ",1,0,1998,0,из
" Этаж ― четырнадцатый, из-за двери донеслось не остервенелое дребезжание колокола, по которому в электромагнитном экстазе лупит молоточек, а ласковое воркование заморской птицы, призывающей хозяев обратить благосклонное внимание на гостя, и хозяева вняли просьбе воркующей пташки, предварительно рассмотрев пришельца через оптическое устройство, вмонтированное в дверь, и та открылась, величаво, будто открыванию предшествовал зычный возглас мажордома: ""Инженер из Москвы Андрей Сургеев!"" ",0,0,1998,0,из
" И на улице хохотал, когда под хлещущим дождём бежал по набережной, ища такси, и в такси хохотал и хохотал, а потом не удержался и рассказал шофёру о том, как в конце сентября 1957 года прибыла в Париж делегация из Москвы, продавать французам крупную партию часов, как французы выдвинули условие: покупаем только механизмы, уж очень убого выглядят русские часы на европейских запястьях; как долго спорили  о названии часов, потому что ""Победа"" никак не соответствовала изящно сработанному корпусу; как полёт первого спутника 4 октября 1957 года решил все споры ― ""Спутник"", только ""Спутник""; как глава делегации Васькянин Т. Г. привез министру внешней торговли подарок от французов, часы, и министр, глянув, увидел то, чего не узрели в Париже русские, со всех сторон обложенные латинским алфавитом: ""СРУТНИК"" ― вот что выведено было на часах  !.. ",0,0,1998,0,из
"  ― Что ж делать-то? ― боязливо спросил гений, и в голосе была надежда: выручай, дорогой товарищ из Москвы, подскажи! ",0,1,1998,0,из
" На русском ― живо интересуется новостями из Москвы, рассказывает о своём житье: с шести утра учит язык, потом учит роль, потом снова учит язык, потом репетирует роль, потом играет спектакль, потом― короткий сон, во время которого разговаривает на двух языках сразу… ",0,0,1994,0,из
" Это позволяло проводить Олимпиаду, лепить из Москвы образ образцового (в их понимании) города, но самое важное ― часть москвичей получила возможность покупать не только капусту, но и персики, а то и виноград, которые государственная советская система к тому времени почти разучилась производить. ",1,0,1997,0,из
"  Я честно признаюсь, что журналистка, из Москвы. ",0,0,1997,0,из
" Это был звёздный час: к нему повели кур, коров, из Москвы приезжала лечить бесплодие заведующая районо. ",1,0,1997,0,из
" Потом познакомилась с одними людьми из Москвы, актёрами. ",0,0,1997,0,из
" Мы летим на самолёте из Москвы в Петербург, Виня задумчиво смотрит в иллюминатор. ",1,0,1997,0,из
" В момент прихода поездов из Москвы интеллигентный голос сообщает приезжающим, что при желании они могут круглые сутки наблюдать на вокзале редких гадов, крокодилов и змей. ",0,0,1997,0,из
 Приближение к Твери (если вы едете из Москвы в Питер) или к Малой Вишере (если наоборот) вызывает у пассажиров страшное волнение. ,1,0,1997,0,из
"  Однажды я везла ""Экспрессом"" из Москвы в Петербург свою американскую приятельницу, хозяйку буржуазной лос-анджелесской галереи. ",1,0,1997,0,из
"  А уже перед самой войной выслали из Москвы и всю семью Идельсонов (очевидно, разрешив взять с собой минимум вещей). ",1,0,1996,0,из
  После окончания института папа получил диплом инженера-строителя и стал часто уезжать из Москвы на различные стройки. ,1,0,1996,0,из
 Но родители всё-таки решили вывезти нас из Москвы ― на дачу к соседям. ,1,0,1996,0,из
"  В конце октября институт, где работал папа, наконец-то получил железнодорожный состав, чтобы эвакуироваться из Москвы. ",1,0,1996,0,из
 Выехали мы из Москвы лишь на следующее утро. ,1,0,1996,0,из
" Кроме того, с нами из Москвы под видом родственницы мама привезла женщину-еврейку из соседнего дома на нашей улице Грановского, которая боялась оставаться в городе. ",1,0,1996,0,из
" А рядом, на этой же улице, в здании местного Политехнического института, размещался эвакуированный из Москвы Архитектурный институт. ",1,0,1996,0,из
" Репрессии по отношению к родственникам ""врагов народа"" продолжались, и Миру отправили из Москвы в далёкую ссылку. ",1,0,1996,0,из
" Именно она дала мне мудрый совет, когда я сомневалась, стоит ли мне уезжать из Москвы, чтобы петь в оперном театре другого города. ",1,0,1996,0,из
" В Ташкенте она получила письмо из Москвы от своей подруги, которая обращалась к ней по-девичьи ласково: ""Дорогая Кисуля! ",1,0,1996,0,из
  Из общих курсов «Историю лингвистических учений» читала профессор из Москвы ― Розалия Осиповна Шор. ,0,0,1995,0,из
" ""― "" Из Москвы, близко, рукой подать, два с половиной часа на машине. ",1,1,1994,0,из
 Я здесь давно не был.  Я из Москвы.  У нас досъемки… ,0,0,1993,0,из
 Туда же поместили одного молодого журналиста из Москвы. ,0,0,1985,0,из
" Отсутствовал он более тридцати лет, ибо отбыл из Москвы в 1925 году. ",1,0,1987,0,из
"  Студенту она очень обрадовалась и сообщила, что она тоже студентка-медичка из Москвы, мобилизована. ",0,0,1987,0,из
